{
  "$schema": "https://json-schema.org/draft/2020-12/schema",
  "$id": "https://cdx.dev/schemas/forms.schema.json",
  "title": "CDX Forms Extension",
  "$defs": {
    "validation": {
      "type": "object",
      "description": "Validation rules for a form field",
      "properties": {
        "required": {
          "type": "boolean",
          "description": "Field must have a value"
        },
        "minLength": {
          "type": "integer",
          "minimum": 0,
          "description": "Minimum string length"
        },
        "maxLength": {
          "type": "integer",
          "minimum": 0,
          "description": "Maximum string length"
        },
        "min": {
          "type": "number",
          "description": "Minimum numeric value"
        },
        "max": {
          "type": "number",
          "description": "Maximum numeric value"
        },
        "pattern": {
          "type": "string",
          "description": "Regular expression pattern to match"
        },
        "email": {
          "type": "boolean",
          "description": "Must be a valid email format"
        },
        "url": {
          "type": "boolean",
          "description": "Must be a valid URL format"
        },
        "containsUppercase": {
          "type": "boolean",
          "description": "Must contain at least one uppercase letter"
        },
        "containsLowercase": {
          "type": "boolean",
          "description": "Must contain at least one lowercase letter"
        },
        "containsDigit": {
          "type": "boolean",
          "description": "Must contain at least one digit"
        },
        "containsSpecial": {
          "type": "boolean",
          "description": "Must contain at least one special character"
        },
        "matchesField": {
          "type": "string",
          "description": "Must match the value of another named field"
        },
        "message": {
          "type": "string",
          "description": "Custom error message for validation failure"
        }
      },
      "additionalProperties": false
    },
    "conditionalValidation": {
      "type": "object",
      "description": "Conditional validation rules based on other field values",
      "required": ["when", "then"],
      "properties": {
        "when": {
          "type": "object",
          "description": "Condition to evaluate",
          "required": ["field"],
          "properties": {
            "field": {
              "type": "string",
              "description": "Name of the field to check"
            },
            "equals": {
              "description": "Condition is true when field equals this value"
            },
            "notEquals": {
              "description": "Condition is true when field does not equal this value"
            },
            "isEmpty": {
              "const": true,
              "description": "Condition is true when field is empty (set to true)"
            },
            "isNotEmpty": {
              "const": true,
              "description": "Condition is true when field is not empty (set to true)"
            }
          },
          "additionalProperties": false
        },
        "then": {
          "$ref": "#/$defs/validation",
          "description": "Validation rules to apply when condition is met"
        }
      },
      "additionalProperties": false
    },
    "option": {
      "type": "object",
      "description": "Option for a dropdown or radio group",
      "required": ["value", "label"],
      "properties": {
        "value": {
          "type": "string",
          "description": "Option value"
        },
        "label": {
          "type": "string",
          "description": "Display label"
        },
        "disabled": {
          "type": "boolean",
          "description": "Whether option is disabled",
          "default": false
        }
      },
      "additionalProperties": false
    },
    "fallbackBlock": {
      "description": "Fallback content for viewers that don't support forms — a real content block conforming to the core content model (typically a paragraph). A non-forms consumer that renders it still applies the renderer-safety allowlists it applies to primary content.",
      "$ref": "https://cdx.dev/schemas/content.schema.json#/$defs/block"
    },
    "baseFormField": {
      "type": "object",
      "description": "Base properties shared by all form fields",
      "properties": {
        "name": {
          "type": "string",
          "description": "Field name for form data"
        },
        "label": {
          "type": "string",
          "description": "Display label"
        },
        "placeholder": {
          "type": "string",
          "description": "Placeholder text"
        },
        "required": {
          "type": "boolean",
          "description": "Whether field is required",
          "default": false
        },
        "disabled": {
          "type": "boolean",
          "description": "Whether field is disabled",
          "default": false
        },
        "validation": {
          "$ref": "#/$defs/validation"
        },
        "conditionalValidation": {
          "$ref": "#/$defs/conditionalValidation"
        },
        "fallback": {
          "$ref": "#/$defs/fallbackBlock"
        }
      }
    },
    "formContainer": {
      "allOf": [
        { "$ref": "https://cdx.dev/schemas/content.schema.json#/$defs/blockBase" },
        {
          "type": "object",
          "description": "Form container block",
          "required": ["type", "children"],
          "properties": {
            "type": { "const": "forms:form" },
            "action": {
              "$ref": "https://cdx.dev/schemas/anchor.schema.json#/$defs/safeUri",
              "description": "Form submission URL. Constrained to safe schemes (see the Renderer Safety core specification): a javascript:/data: action would otherwise be a signed code-execution primitive when carried in signed content."
            },
            "method": {
              "type": "string",
              "enum": ["GET", "POST"],
              "description": "HTTP method for submission",
              "default": "POST"
            },
            "encoding": {
              "type": "string",
              "description": "Form encoding type",
              "default": "application/json"
            },
            "children": {
              "type": "array",
              "description": "Form field blocks and other content blocks",
              "items": { "$ref": "https://cdx.dev/schemas/content.schema.json#/$defs/block" }
            }
          }
        }
      ],
      "unevaluatedProperties": false
    },
    "textInputBlock": {
      "allOf": [
        { "$ref": "https://cdx.dev/schemas/content.schema.json#/$defs/blockBase" },
        { "$ref": "#/$defs/baseFormField" },
        {
          "type": "object",
          "required": ["type", "name"],
          "properties": {
            "type": { "const": "forms:textInput" },
            "inputType": {
              "type": "string",
              "enum": ["text", "email", "password", "tel", "number"],
              "description": "HTML input type",
              "default": "text"
            },
            "maxLength": {
              "type": "integer",
              "minimum": 1,
              "description": "Maximum character length"
            },
            "autocomplete": {
              "type": "string",
              "description": "Autocomplete hint"
            }
          }
        }
      ],
      "unevaluatedProperties": false
    },
    "textAreaBlock": {
      "allOf": [
        { "$ref": "https://cdx.dev/schemas/content.schema.json#/$defs/blockBase" },
        { "$ref": "#/$defs/baseFormField" },
        {
          "type": "object",
          "required": ["type", "name"],
          "properties": {
            "type": { "const": "forms:textArea" },
            "rows": {
              "type": "integer",
              "minimum": 1,
              "description": "Number of visible text rows",
              "default": 4
            },
            "maxLength": {
              "type": "integer",
              "minimum": 1,
              "description": "Maximum character length"
            }
          }
        }
      ],
      "unevaluatedProperties": false
    },
    "checkboxBlock": {
      "allOf": [
        { "$ref": "https://cdx.dev/schemas/content.schema.json#/$defs/blockBase" },
        { "$ref": "#/$defs/baseFormField" },
        {
          "type": "object",
          "required": ["type", "name"],
          "properties": {
            "type": { "const": "forms:checkbox" },
            "defaultChecked": {
              "type": "boolean",
              "description": "Initial checked state",
              "default": false
            }
          }
        }
      ],
      "unevaluatedProperties": false
    },
    "radioGroupBlock": {
      "allOf": [
        { "$ref": "https://cdx.dev/schemas/content.schema.json#/$defs/blockBase" },
        { "$ref": "#/$defs/baseFormField" },
        {
          "type": "object",
          "required": ["type", "name", "options"],
          "properties": {
            "type": { "const": "forms:radioGroup" },
            "options": {
              "type": "array",
              "description": "Radio button options",
              "items": { "$ref": "#/$defs/option" },
              "minItems": 1
            },
            "defaultValue": {
              "type": "string",
              "description": "Default selected value"
            }
          }
        }
      ],
      "unevaluatedProperties": false
    },
    "dropdownBlock": {
      "allOf": [
        { "$ref": "https://cdx.dev/schemas/content.schema.json#/$defs/blockBase" },
        { "$ref": "#/$defs/baseFormField" },
        {
          "type": "object",
          "required": ["type", "name", "options"],
          "properties": {
            "type": { "const": "forms:dropdown" },
            "options": {
              "type": "array",
              "description": "Dropdown options",
              "items": { "$ref": "#/$defs/option" },
              "minItems": 1
            },
            "defaultValue": {
              "type": ["string", "array"],
              "items": { "type": "string" },
              "description": "Default selected value — a single string, or an array of strings when `multiple` is true"
            },
            "searchable": {
              "type": "boolean",
              "description": "Enable search/filter functionality",
              "default": false
            },
            "multiple": {
              "type": "boolean",
              "description": "Allow multiple selections",
              "default": false
            }
          }
        }
      ],
      "unevaluatedProperties": false
    },
    "datePickerBlock": {
      "allOf": [
        { "$ref": "https://cdx.dev/schemas/content.schema.json#/$defs/blockBase" },
        { "$ref": "#/$defs/baseFormField" },
        {
          "type": "object",
          "required": ["type", "name"],
          "properties": {
            "type": { "const": "forms:datePicker" },
            "format": {
              "type": "string",
              "description": "Date format pattern (e.g., 'YYYY-MM-DD')",
              "default": "YYYY-MM-DD"
            },
            "minDate": {
              "type": "string",
              "description": "Minimum selectable date (ISO date or 'today')"
            },
            "maxDate": {
              "type": "string",
              "description": "Maximum selectable date (ISO date or 'today')"
            },
            "includeTime": {
              "type": "boolean",
              "description": "Include time selection",
              "default": false
            }
          }
        }
      ],
      "unevaluatedProperties": false
    },
    "signatureBlock": {
      "allOf": [
        { "$ref": "https://cdx.dev/schemas/content.schema.json#/$defs/blockBase" },
        { "$ref": "#/$defs/baseFormField" },
        {
          "type": "object",
          "required": ["type", "name"],
          "properties": {
            "type": { "const": "forms:signature" },
            "width": {
              "type": "integer",
              "minimum": 100,
              "description": "Signature pad width in pixels"
            },
            "height": {
              "type": "integer",
              "minimum": 50,
              "description": "Signature pad height in pixels"
            }
          }
        }
      ],
      "unevaluatedProperties": false
    },
    "submitBlock": {
      "allOf": [
        { "$ref": "https://cdx.dev/schemas/content.schema.json#/$defs/blockBase" },
        {
          "type": "object",
          "description": "Form submit button",
          "required": ["type"],
          "properties": {
            "type": { "const": "forms:submit" },
            "label": {
              "type": "string",
              "description": "Button label",
              "default": "Submit"
            }
          }
        }
      ],
      "unevaluatedProperties": false
    },
    "dataFile": {
      "type": "object",
      "description": "Schema for forms/data.json",
      "required": ["version", "values"],
      "properties": {
        "version": {
          "type": "string",
          "description": "Forms extension version",
          "pattern": "^\\d+\\.\\d+$"
        },
        "values": {
          "type": "object",
          "description": "Per-form field values, keyed by the enclosing forms:form block id; each entry maps that form's field names to their values. Keying by form id keeps identically-named fields (e.g. `email`) in different forms from colliding in one flat namespace.",
          "additionalProperties": {
            "type": "object",
            "description": "One form's field-name → value map",
            "additionalProperties": true
          }
        },
        "submitted": {
          "type": "object",
          "description": "Per-form submission flag, keyed by forms:form block id; a form's value is `true` once that form has been submitted.",
          "additionalProperties": {
            "type": "boolean"
          }
        },
        "submittedAt": {
          "type": "object",
          "description": "Per-form ISO 8601 submission timestamp, keyed by forms:form block id.",
          "additionalProperties": {
            "type": "string",
            "format": "date-time"
          }
        },
        "lastModified": {
          "type": "string",
          "format": "date-time",
          "description": "ISO 8601 last modification timestamp for the data file"
        }
      },
      "additionalProperties": false
    }
  },
  "type": "object",
  "description": "Forms data file",
  "$ref": "#/$defs/dataFile"
}
